<?xml version="1.0" encoding="UTF-8"?>
<!--
To change this license header, choose License Headers in Project Properties.
To change this template file, choose Tools | Templates
and open the template in the editor.
-->

<!DOCTYPE equipos SYSTEM "sintesis.dtd">
<equipos xmlns:xsi="http://www.w3.org/2001/XMLSchema-instance" xsi:noNamespaceSchemaLocation="sintesis.xsd">
    <equipo>
        <patrocodinadores fecha="2017-06-06">
            <patrocinador>patro</patrocinador>
            <patrocinador>patroci</patrocinador>
        </patrocodinadores>
        <eventosParticipado>muchos</eventosParticipado>
        <nombreEq>EquipoUno</nombreEq>
        <competiciones>
            <competicion>ligaCatalana</competicion>
        </competiciones>
        <trabajo tipo="desarrollo"/>
        <exitos>
            <anyos>
                <anyo num="1999">
                    <resultado igual="exito"/>
                    <resultado igual="fracaso"/>
                    <resultado igual="exito"/>
                    <resultado igual="exito"/>
                </anyo>
                <anyo num="2000">
                    <resultado igual="fracaso"/>
                    <resultado igual="fracaso"/>
                    <resultado igual="exito"/>
                    <resultado igual="exito"/>
                </anyo>
            </anyos>
        </exitos>
        <integrantes>
            <integrante nacionalidad="francesa"> <!--nacionalidad="francesa" -->
                <nombre>pepe</nombre>
                <apellido>perez</apellido>
                <cargo>ejecutivo</cargo>
                <fechaNac>1986-10-21</fechaNac>
                <rutaImg extension="jpg">c:/olakase</rutaImg>
                <ultHoraPart>18:00:00</ultHoraPart>
                <ultFechaEmp>2017-06-03</ultFechaEmp>
                <estadisticas>
                    <goles marcados="100"/>
                    <minions eliminados="50"/>
                </estadisticas>
            </integrante>
            <integrante nacionalidad="marciana"> <!--nacionalidad="marciana" -->
                <nombre>pepito</nombre>
                <apellido>peraz</apellido>
                <cargo>curro</cargo>
                <fechaNac>1986-10-20</fechaNac>
                <ultHoraPart>18:00:00</ultHoraPart>
                <ultFechaEmp>2017-06-03</ultFechaEmp>
                <estadisticas>
                    <goles marcados="100"/>
                    <minions eliminados="50"/>
                </estadisticas>
            </integrante>
        </integrantes>
    </equipo>
    <equipo>
        <patrocodinadores fecha="2017-05-06">
            <patrocinador>patron</patrocinador>
            <patrocinador>patrocin</patrocinador>
        </patrocodinadores>
        <eventosParticipado>muchos</eventosParticipado>
        <nombreEq>equipoDos</nombreEq>
        <competiciones>
            <competicion>ligaCatalana</competicion>
        </competiciones>
        <trabajo tipo="protegerUniverso"/>
        <exitos>
            <anyos>
                <anyo num="1995">
                    <resultado igual="fracaso"/>
                    <resultado igual="fracaso"/>
                </anyo>
                <anyo num="1996">
                    <resultado igual="exito"/>
                    <resultado igual="exito"/>
                    <resultado igual="exito"/>
                </anyo>
            </anyos>
        </exitos>
        <integrantes>
            <integrante nacionalidad="francesa"> <!--nacionalidad="francesa" -->
                <nombre>he</nombre>
                <apellido>man</apellido>
                <cargo>heroe</cargo>
                <fechaNac>1983-01-01</fechaNac>
                <rutaImg extension="jpg">c:/olakase</rutaImg>
                <ultHoraPart>10:00:00</ultHoraPart>
                <ultFechaEmp>2015-11-05</ultFechaEmp>
                <estadisticas>
                    <golpes dados="98984"/>
                    <golpes recibidos="2"/>
                </estadisticas>
            </integrante>
            <integrante nacionalidad="marciana"> <!--nacionalidad="marciana" -->
                <nombre>dun</nombre>
                <apellido>can</apellido>
                <cargo>maestro armas</cargo>
                <fechaNac>1983-01-02</fechaNac>
                <ultHoraPart>18:00:00</ultHoraPart>
                <ultFechaEmp>2017-06-03</ultFechaEmp>
                <estadisticas>
                    <goles marcados="100"/>
                    <minions eliminados="50"/>
                </estadisticas>
            </integrante>
        </integrantes>
    </equipo>
</equipos>
